{
  "version_contrato": 3,
  "ack_id": "31313131-3131-4313-8313-313131313132",
  "pos_instance_id": "23232323-2323-4232-8232-232323232323",
  "sucursal": {
    "id": "11111111-1111-4111-8111-111111111111",
    "clave": "LAB01"
  },
  "release_id": "28282828-2828-4282-8282-282828282828",
  "publicacion_id": "29292929-2929-4292-8292-292929292929",
  "version_sucursal": 1,
  "contenido_sha256": "ffffffffffffffffffffffffffffffffffffffffffffffffffffffffffffffff",
  "estado": "rechazado",
  "registrado_en": "2026-09-25T08:00:03-06:00",
  "resultado": {
    "codigo": "checksum_invalido",
    "detalle": "La suma recibida no coincide con el contenido descargado."
  },
  "mapeos_categoria": [],
  "mapeos_producto": []
}
